{
  "blocked_tasks": [],
  "checkpoints": [
    "session-preparing-agent-1620952d98",
    "complexity-estimate",
    "runtime-zombie-recovered-20260529T044905Z"
  ],
  "completed_tasks": [],
  "created_at": "2026-05-28T22:29:05.508836+00:00",
  "current_task_id": null,
  "failed_tasks": [],
  "last_preparing_at": "2026-05-28T22:29:05.508836+00:00",
  "mode": "build",
  "preparing_session_id": "agent-1620952d98",
  "project_id": "continuity-math-pf-026",
  "schema_version": 1,
  "status": "initialized",
  "updated_at": "2026-05-29T04:49:05.611610+00:00",
  "last_released_zombie_task_ids": [
    "RUNTIME-20260528222906-001"
  ],
  "last_released_zombie_at": "2026-05-29T04:49:05.611610+00:00",
  "last_released_zombie_reason": "No active agent session, no live worker, and stale disk activity."
}
