{
  "blocked_tasks": [],
  "checkpoints": [
    "session-preparing-agent-7587ad1297",
    "complexity-estimate",
    "runtime-20260530125000-001-checkpoint"
  ],
  "completed_tasks": [
    "RUNTIME-20260530125000-001"
  ],
  "created_at": "2026-05-30T12:50:00.108168+00:00",
  "current_task_id": null,
  "failed_tasks": [],
  "last_preparing_at": "2026-05-30T12:50:00.108168+00:00",
  "mode": "build",
  "preparing_session_id": "agent-7587ad1297",
  "project_id": "continuity-math-pf-020-2",
  "schema_version": 1,
  "status": "completed",
  "updated_at": "2026-05-30T12:54:07.718504+00:00"
}
