{
  "blocked_tasks": [],
  "checkpoints": [
    "session-preparing-agent-2b48978241",
    "complexity-estimate",
    "runtime-20260529052013-001-checkpoint"
  ],
  "completed_tasks": [
    "RUNTIME-20260529052013-001"
  ],
  "created_at": "2026-05-29T05:20:13.753128+00:00",
  "current_task_id": null,
  "failed_tasks": [],
  "last_preparing_at": "2026-05-29T05:20:13.753128+00:00",
  "mode": "build",
  "preparing_session_id": "agent-2b48978241",
  "project_id": "continuity-math-pf-001-3",
  "schema_version": 1,
  "status": "completed",
  "updated_at": "2026-05-29T05:20:53.048239+00:00"
}
