{
  "blocked_tasks": [],
  "checkpoints": [
    "recovery-001-retry-0-recovery",
    "recovery-001-checkpoint"
  ],
  "completed_tasks": [
    "RECOVERY-001"
  ],
  "created_at": "2026-05-15T23:36:27Z",
  "current_task_id": null,
  "failed_tasks": [],
  "mode": "build",
  "project_id": "benchmark-recovery-05",
  "schema_version": 1,
  "status": "completed",
  "updated_at": "2026-05-15T23:36:27.635368+00:00"
}
