{
  "blocked_tasks": [],
  "checkpoints": [
    "smoke-001-checkpoint"
  ],
  "completed_tasks": [
    "SMOKE-001"
  ],
  "created_at": "2026-05-15T17:44:08Z",
  "current_task_id": null,
  "failed_tasks": [],
  "mode": "smoke",
  "project_id": "benchmark-smoke-01",
  "schema_version": 1,
  "status": "completed",
  "updated_at": "2026-05-15T17:44:08.483480+00:00"
}
