{
  "blocked_tasks": [],
  "checkpoints": [
    "session-preparing-agent-7400b05f9f",
    "complexity-estimate",
    "runtime-20260530125630-001-checkpoint"
  ],
  "completed_tasks": [
    "RUNTIME-20260530125630-001"
  ],
  "created_at": "2026-05-30T12:56:29.164891+00:00",
  "current_task_id": null,
  "failed_tasks": [],
  "last_preparing_at": "2026-05-30T12:56:29.164891+00:00",
  "mode": "build",
  "preparing_session_id": "agent-7400b05f9f",
  "project_id": "continuity-math-pf-023-2",
  "schema_version": 1,
  "status": "completed",
  "updated_at": "2026-05-30T12:57:20.573722+00:00"
}
