{
  "blocked_tasks": [],
  "checkpoints": [
    "crud-ui-001-checkpoint",
    "crud-ui-002-checkpoint",
    "crud-ui-003-checkpoint"
  ],
  "completed_tasks": [
    "CRUD-UI-001",
    "CRUD-UI-002",
    "CRUD-UI-003"
  ],
  "created_at": "2026-05-15T17:44:08Z",
  "current_task_id": null,
  "failed_tasks": [],
  "mode": "build",
  "project_id": "benchmark-crud-ui-02",
  "schema_version": 1,
  "status": "completed",
  "updated_at": "2026-05-15T17:44:08.813074+00:00"
}
