{
  "blocked_tasks": [],
  "checkpoints": [
    "refactor-001-checkpoint"
  ],
  "completed_tasks": [
    "REFACTOR-001"
  ],
  "created_at": "2026-05-15T18:41:33Z",
  "current_task_id": null,
  "failed_tasks": [],
  "mode": "medium",
  "project_id": "benchmark-refactor-mid-03",
  "schema_version": 1,
  "status": "completed",
  "updated_at": "2026-05-15T18:41:33.414320+00:00"
}
